<?xml version="1.0" encoding="UTF-8"?>
<?xml-stylesheet type="text/xsl" href="lab3.xsl"?>
<pet_store xmlns:xsi="http://www.w3.org/2001/XMLSchema-instance"
xsi:noNamespaceSchemaLocation="lab3.xsd">
    <pet>
        <name>egg</name>
        <breed>dog</breed>
        <discription>golden</discription>
        <age>3</age>
        <quantity>4</quantity>
        <price>7000</price>
        <availability>available</availability>
        <store>XYZ</store>
    </pet>
    <pet>
        <name>lucky</name>
        <breed>dog</breed>
        <discription>labrador</discription>
        <age>1</age>
        <quantity>10</quantity>
        <price>8000</price>
        <availability>available</availability>
        <store>ZYX</store>
    </pet>
    <pet>
        <name>vicky</name>
        <breed>dog</breed>
        <discription>labrador</discription>
        <age>3</age>
        <quantity>2</quantity>
        <price>4000</price>
        <availability>non-available</availability>
        <store>ZYX</store>
    </pet>

</pet_store>